Titre;Description;MotsClés;NomDuLieu;CodePostal;Ville;Région;Département;TypeEvénement;AgeMinimum;AgeMaximum;ConditionsDeParticipation
Soirée jeux;Venez passez un moment convivial en famille ou entre amis autour de nos jeux de société !;"jeux de société;jeux;divertissement";Médiathèque Jean Giraudoux;87300;Bellac;Nouvelle-Aquitaine;Haute-Vienne;Soirée jeux (jeux de société, jeux vidéo, jeux d’évasion/escape game);3;99;Entrée libre
"Après-midi jeu ""Les loups-garous de Thiercelieux""";"""Les loups-garous de Thiercelieux"" est un jeu de rôle simple, où les villageois doivent découvrir qui sont les loups-garous avant d'être dévorés !";"Loups-garous;Thiercelieux;Jeu;Jeu de société;Jeu de rôle;Villageois;Pouvoirs;Jeux;Jeux de société";Médiathèque Jean Giraudoux;87300;Bellac;Nouvelle-Aquitaine;Haute-Vienne;Soirée jeux (jeux de société, jeux vidéo, jeux d’évasion/escape game);10;99;Sur inscription
Lecture d'albums pour enfants;Lectures d’albums pour les enfants par les bénévoles de l’association Lire et Faire Lire.;"Lecture d'albums jeunesse;Lecture d'albums pour enfants";Médiathèque Blaise Cendrars;78700;Conflans-Sainte-Honorine;Île-de-France;Yvelines;Lecture / Conte;1;10;Entrée libre
Buffet participatif;Apportez un plat et la médiathèque s’occupe des boissons pour un repas commun !;"Buffet participatif;repas en partage";Médiathèque Blaise Cendrars;78700;Conflans-Sainte-Honorine;Île-de-France;Yvelines;Dégustation, buffet, collation…;1;99;Entrée libre
Jeu : Les Loups Garous de Thiercelieux;Venez jouer à Loup-Garou, un jeu de société à la frontière du jeu de rôle.;"Jeu de rôle;jeu de société";Médiathèque Blaise Cendrars;78700;Conflans-Sainte-Honorine;Île-de-France;Yvelines;Soirée jeux (jeux de société, jeux vidéo, jeux d’évasion/escape game);12;99;Entrée libre
Fées contre faits, de la lecture au théâtre;Rencontrer les jeunes comédiens et l’équipe du tournage “Fées contre faits. De la lecture au théâtre” à l’occasion d’une performance de lecture à voix haute et assister à la projection du film.;"Lecture;théâtre;enfant;jeunesse;adolescent;patrimoine;archéologie;littérature;spectacle;film;projection;voix haute;rencontre;discussion";Conservatoire Gabriel Fauré;78730;Saint-Arnoult-en-Yvelines;Île-de-France;;Spectacle (danse, concert, performance, théâtre…);8;99;Sur inscription
Nuit de la lecture sur l'Île Saint Louis : lectures par Dominique Lerat;Nuit de la lecture sur l'Ile Saint Louis à la librairie ULYSSE;"Librairie Ulysse;voyage;ile saint louis;Catherine Domain;poesie;mer;antarctique;arctique;anita conti;stephane dugast;Boileau;Baudelaire";Librairie Ulysse;75004;Paris;Île-de-France;Paris;Lecture / Conte;7;99;Entrée libre
Concert surprise !;La bibliothèque ouvre ses portes pour une soirée exceptionnelle et vous aurez jusqu'à 22h pour dévorer les 23 000 ouvrages de la bibliothèque.;;Bibliothèque Crimée;75019;Paris;Île-de-France;Paris;Spectacle (danse, concert, performance, théâtre…);;;Sur inscription
Escape game;Escape game pour découvrir le magasin de la Bibliothèque départementale de l'Aisne;Escape game;Centre des Archives et de la Bibliothèque départementales de l'Aisne;2000;Laon;Hauts-de-France;Aisne;Soirée jeux (jeux de société, jeux vidéo, jeux d’évasion/escape game);;;Sur inscription
Concert Fresh'n'Peach;Concert Fresh'n'Peach;"concert;Jazz;Boris Vian";Médiathèque de Condé-sur-Suippe;2190;Condé-sur-Suippe;Hauts-de-France;Aisne;Spectacle (danse, concert, performance, théâtre…);;;Entrée libre
Textes offerts;"Dans l'esprit de la ""grande lessive"", les participants ramènent un texte de leur création (ou non) pour l'exposer et le lire (ou le faire lire) à l'auditoire.";partage lecture exposition;Bibliothèque municipale de Montolieu;11170;Montolieu;Occitanie;Aude;Exposition;;;Entrée libre
Lectures;"Lecture de nouvelles ou d'extraits de romans ayant pour thème le ""policier""";;Centre des Archives et de la Bibliothèque départementales de l'Aisne;2000;Laon;Hauts-de-France;Aisne;Lecture / Conte;;;Entrée libre
"Nuit fantastique à Angers : ""Ne snobez pas la nuit de la lecture"" !";Lecture et mise en musique de l'oeuvre de Boris Vian;"angers;librairie;Lhériau;bibliothèque;fantastique;Boris;Vian;comédiens;lecture;musique";Librairie Lhériau;49100;Angers;Pays de la Loire;Maine-et-Loire;Spectacle (danse, concert, performance, théâtre…);;;Sur inscription
Soirée pyjama;20 enfants, une librairie la nuit, des auteurs stars, des jeux...;soiree pyjama;Librairie Folies d'encre Montreuil;93100;Montreuil;Île-de-France;Seine-Saint-Denis;Rencontre d'auteur(s) et dédicace;5;10;Sur inscription
Rencontres et dédicaces d'auteurs culinaires;Rencontres d'auteurs culinaires;auteur culinaire dédicace montmorillon;L’ARTelier de la Gartempe - Cité de l'écrit;86500;Montmorillon;Nouvelle-Aquitaine;Vienne;Rencontre d'auteur(s) et dédicace;8;99;Entrée libre
Je programme et je lis en français;Atelier parents-enfants de programmation d'abeilles.;"programmation;lecture;contes";Relais BDBR de Sarre-Union;67260;Sarre-Union;Grand Est;Bas-Rhin;Atelier;4;99;Sur inscription
Venez partager vos lectures préférées ou simplement écouter et découvrir des textes;Lectures;lecture partagée      comédiens amateurs;Médiathèque Joseph Schaefer;57230;Bitche;Grand Est;Moselle;Lecture / Conte;12;99;Entrée libre
Je programme et je lis en langues étrangères;Atelier parents-enfants de programmation d'abeilles;"programmation;lecture;conte";Relais BDBR de Sarre-Union;67260;Sarre-Union;Grand Est;Bas-Rhin;Atelier;4;99;Sur inscription
"Spectacle : ""Les carottes sont cuites"" par la compagnie en musique";Dans une cuisine qui semble bien ordinaire, les carottes vont devenir le centre de toutes les attentions...;"spectacle;cuisine";Relais BDBR de Sarre-Union;67260;Sarre-Union;Grand Est;Bas-Rhin;Spectacle (danse, concert, performance, théâtre…);2;99;Entrée libre
Plongez en Méditerranée à la bibliothèque universitaire La Garde;Venez déambuler dans la bibliothèque et découvrir plusieurs performances artistiques autour du thème de la Méditerranée.;;Bibliothèque universitaire - Campus La Garde;83130;La Garde;Provence-Alpes-Côte d'Azur;Var;Spectacle (danse, concert, performance, théâtre…);;;Entrée libre
Marathon de lecture;Les participants auront 5h pour lire un livre. Chacun lira à tour de rôle.;lecture;Résidence Domitys La Poudre de Lin;76290;Montivilliers;Normandie;Seine-Maritime;Lecture / Conte;15;99;Entrée libre
Un parcours du Ve de la lecture carte en main : un arrêt lecture chez le coiffeur;Au cours d’une soirée itinérante autour du livre et de la lecture dans le Ve, en suivant la carte Notre Ve du livre, laissez vos pas vous porter chez Claude Ferron, coiffeur et grand lecteur ...;"insolite;artisan;rencontre;musique;cinéphile;carte";Salon Claude Ferron;75005;Paris;Île-de-France;Paris;Lecture / Conte;;99;Entrée libre
Soirée récréative avec une conteuse;Nous proposons une fin d'après-midi récréative, animée par une conteuse et  agrémentée d'une collation.;"après-midi récréative;conteuse;collation";Bibliothèque pour Tous;27700;Les Andelys;Normandie;Eure;Lecture / Conte;;99;Entrée libre
Mossieu Jourdain on stage! Spectacle;Une libre adaptation du Bourgeois gentilhomme pour un seul comédien.;spectacle;La Source Médiathèque;50000;Saint-Lô;Normandie;Manche;Spectacle (danse, concert, performance, théâtre…);12;99;Sur inscription
Concert ensemble du LORIA;Musique Trance;"musique électronique;concert;dance;vidéo";Bibliothèque universitaire de Nancy - Espace Déléage;54000;Nancy;Grand Est;Meurthe-et-Moselle;Spectacle (danse, concert, performance, théâtre…);;99;Entrée libre
"Atelier "" Jeux de société """;Jeux de société pour tous;;Bibliothèque Au jardin des livres;55320;Dieue-sur-Meuse;Grand Est;Meuse;Soirée jeux (jeux de société, jeux vidéo, jeux d’évasion/escape game);;;Entrée libre
"""Planète Marionnettes"" - Exposition de la MDN";Les Marionnettes sous toutes ses formes;"Marionnette;Noueaux horaires;Nouvelles animations";Salle communale d'Escobecques;59320;Escobecques;Hauts-de-France;Nord;Exposition;;;Entrée libre
Création de Marionnettes Chaussettes;Les Marionnettes sous toutes ses formes;"Marionnette;Noueaux horaires;Nouvelles animations";Salle communale d'Escobecques;59320;Escobecques;Hauts-de-France;Nord;Atelier;;;Sur inscription
(Re)découverte du patrimoine Meynois;Une habitante bénévole de Meynes viendra vous présenter l'histoire du village et échanger avec les plus curieux, pour découvrir le patrimoine Meynois;;Médiathèque de Meynes;30840;Meynes;Occitanie;;Conférence / table-ronde;;;Entrée libre
L'oiseau de pluie : conte en musique;L'oiseau de pluie, conte en musique en partenariat evec l'école municipale de musique de Saran;"conte;histoires;musique";Médiathèque de Saran;45770;Saran;Centre-Val de Loire;Loiret;Lecture / Conte;7;99;Entrée libre
Café des pas perdus : création sonore à voix lue;Création hybride - entre lecture, concert, émission littéraire et pièce radiophonique, Café des pas perdus propose de se laisser guider, dans un voyage immobile.;"lecture;littéraire";Bibliothèque du Grand Auch Coeur de Gascogne;32000;Auch;Occitanie;Gers;Lecture / Conte;12;99;Entrée libre
Lectures du vent par Silvia Baron Supervielle;Lecture de poèmes, extraits des lectures du vent, par son auteur Silvia Baron Supervielle;"poème;lecture;lettres;littérature;ile st louis;pharmacie;argentine;auteur;livre;nouvelle;silvia baron supervielle;jose luis borges;marguerite yourcenar;buenos aires;lectures du vent;jose corti;evenement;traductions;espagnol";Pharmacie de l'île saint Louis;75004;Paris;Île-de-France;Paris;Lecture / Conte;;;Entrée libre
Lecture pour le jeune public à partir de 3 ans;Venez découvrir des histoires coups de coeur lues par les bibliothécaires et des lecteurs bénévoles de la ville;;Médiathèque de Chalonnes-sur-Loire;49290;Chalonnes-sur-Loire;Pays de la Loire;Maine-et-Loire;Lecture / Conte;3;99;Entrée libre
Nocturne jusqu'à minuit, avec des surprises!;Ouverture exceptionnelle de la médiathèque de 20h à Minuit;;Médiathèque Boris Vian;95340;Persan;Île-de-France;Val-d'Oise;Partage de coups de cœur, conseils de lecture, « speed-booking »;;;Entrée libre
Soirée frisson;Pyjama obligatoire, doudous acceptés  et parents inderdits.;"Histoires;frissons;soirée pyjama";Bibliothèque de Sully-sur-Loire;45600;Sully-sur-Loire;Centre-Val de Loire;Loiret;Lecture / Conte;6;12;Sur inscription
Décoration d’une fresque avec Barbara Martinez;En compagnie de Barbara Martinez, coloriez et personnalisez des oiseaux-poèmes.;"Famille;Atelier;Auteur;Création;Barbara Martinez";Médiathèque de Saint-Cloud;92210;Saint-Cloud;Île-de-France;Hauts-de-Seine;Atelier;6;99;Entrée libre
Duel d’impro (avec deux comédiens de la Ligue majeure d’improvisation);Duel d'improvisation de deux comédiens;"Spectale d'improvisation;Ligue majeure d'improvisation";Médiathèque de Saint-Cloud;92210;Saint-Cloud;Île-de-France;Hauts-de-Seine;Spectacle (danse, concert, performance, théâtre…);;;Entrée libre
Murder party;Enquête sur un meurtre à la médiathèque;"murder party;enquête";Médiathèque L'Echo;94270;Le Kremlin-Bicêtre;Île-de-France;Val-de-Marne;Soirée jeux (jeux de société, jeux vidéo, jeux d’évasion/escape game);12;99;Sur inscription
"Lecture du conte ""la Sirène de Pempoul"" par Paul Rigolot";"Lecture du conte ""la Sirène de Pempoul"" par Paul Rigolot en costume avec introduction et intermède à la flûte";"lecture;conte;recueil";Librairie Les Chemins du livre;78600;Maisons-Laffitte;Île-de-France;Yvelines;Lecture / Conte;;;Sur inscription
Atelier attrape-rêves;Pour passer de belles nuits et faire de jolis rêves, quoi de mieux qu’un attrape-rêves à accrocher près de votre lit. Venez le fabriquer avec nous !;Atelier créatif;Médiathèque-Ludothèque Bernard-Ywanne;94380;Bonneuil-sur-Marne;Île-de-France;Val-de-Marne;Atelier;6;99;Entrée libre
Spectacle de magie;Pour clôturer cette soirée…de rêve , un spectacle magique entre réalité et illusions pour les petits et les grands!;"Spectacle;Magicien;Magie";Médiathèque-Ludothèque Bernard-Ywanne;94380;Bonneuil-sur-Marne;Île-de-France;Val-de-Marne;Spectacle (danse, concert, performance, théâtre…);6;99;Sur inscription
Exposition photo;Exposition de photographies et rencontre avec l'artiste;"photographie;rencontre d'artiste";Médiathèque municipale de Meilhan-sur-Garonne;47180;Meilhan-sur-Garonne;Nouvelle-Aquitaine;Lot-et-Garonne;Exposition;;;Entrée libre
Lectures musicales;Lecture musicale retraçant l'épique voyage d'Alexandre Von Humboldt en 1800 à la découverte de la forêt amazonienne;"lectures musicales;ado-adultes;Médiathèque intercommunale La Passerelle";Mediathèque intercommunale La Passerelle;1600;Trévoux;Auvergne-Rhône-Alpes;Ain;Lecture / Conte;13;99;Sur inscription
Rallye Lecture;Rallye Lecture;"lectures;partage;prix;équipe;loups;jeu;histoires;animation;enfants;famille";Médiathèque de Meyreuil;13590;Meyreuil;Provence-Alpes-Côte d'Azur;Bouches-du-Rhône;Lecture / Conte;6;99;Sur inscription
Blind test littéraire;Blind test littéraire;Blind test;Bibliothèque universitaire de l'Arsenal - Université Toulouse 1 Capitole;31000;Toulouse;Occitanie;Haute-Garonne;Soirée jeux (jeux de société, jeux vidéo, jeux d’évasion/escape game);16;99;Entrée libre
Jeu littéraire;Jeu littéraire;"jeu;atelier;écriture;nuit;cadavres exquis";Bibliothèque Geneviève Fauconnier;17210;Saint-Palais-de-Négrignac;Nouvelle-Aquitaine;Charente-Maritime;Atelier;12;99;Entrée libre
Quizz;Quizz;"quizz;nuit;planètes;étoiles;constellations";Bibliothèque Geneviève Fauconnier;17210;Saint-Palais-de-Négrignac;Nouvelle-Aquitaine;Charente-Maritime;Projection;12;99;Entrée libre
Lectures à haute voix;Lectures à haute voix.;"lectures;voix haute;poésie;extraits;nuit;partage;écoute";Bibliothèque Geneviève Fauconnier;17210;Saint-Palais-de-Négrignac;Nouvelle-Aquitaine;Charente-Maritime;Lecture / Conte;12;99;Entrée libre
"""À voix haute"", lecture de textes littéraires";Lectures à voix haute et rencontre avec les auteurs;;DRAC de Normandie;14000;Caen;Normandie;Calvados;Lecture / Conte;;;Sur inscription
Escape Game : Panique dans la bibliothèque !;Panique à la bibliothèque de Saint-Eloi-de-Fourques !;"escape game;sciences;enquête";Centre Culturel et Multimédia;27370;Saint-Éloi-de-Fourques;Normandie;Eure;Soirée jeux (jeux de société, jeux vidéo, jeux d’évasion/escape game);10;99;Sur inscription
Nuit de la Lecture à l'Université de Limoges - Chansons de Boris Vian;Chansons de Boris Vian interprétées par Nadine Béchade de la Cie La Belle Friche;"Boris Vian;Chansons;Nuit lecture;Partage";Bibliothèque universitaire de Droit et Sciences économiques de Limoges;87000;Limoges;Nouvelle-Aquitaine;Haute-Vienne;Spectacle (danse, concert, performance, théâtre…);6;99;Entrée libre
"Nuit de la lecture à l'Université de Limoges  ""Amis levons nos vers ""! - Lecture par des comédiens professionnels de la Cie La Belle Friche";Lecture par des comédiens professionnels de la Cie La Belle Friche sur le thème du partage;"Lecture;Partage";Bibliothèque universitaire de Droit et Sciences économiques de Limoges;87000;Limoges;Nouvelle-Aquitaine;Haute-Vienne;Lecture / Conte;6;99;Entrée libre
"Nuit fantastique à Angers - Conférence sur les araignées : ""Même pas peur"" !";Désensibilisation avec humour à la peur de l'araignée.;"Christine Rollard;araignée;Fred Vargas;Muséum;Angers;Toussaint;Médiathèque;Bibliothèque;Conférence";Médiathèque Toussaint;49100;Angers;Pays de la Loire;Maine-et-Loire;Conférence / table-ronde;;;Entrée libre
Nuit fantastique à Angers - Les quiz !;Quiz spécial Harry Potter;"médiathèque;bibliothèque;toussaint;angers;harry;potter;quiz;quizz;jeux";Médiathèque Toussaint;49100;Angers;Pays de la Loire;Maine-et-Loire;Soirée jeux (jeux de société, jeux vidéo, jeux d’évasion/escape game);7;99;Entrée libre
Nuit fantastique à Angers - Cabinet de curiosités fantastiques;"Venez observer de drôles d'objets sous vitrines ou sur table et écoutez une bande son : ""c'est quoi pour toi le fantastique ?""";"angers;médiathèque;bibliothèque;toussaint;curiosité;fantastique";Médiathèque Toussaint;49100;Angers;Pays de la Loire;Maine-et-Loire;Exposition;;;Entrée libre
Nuits fatales;Traversées polyphoniques;"roman policier;Jacques Develay;Poitiers;traversées";Médiathèque Médiasud;86000;Poitiers;Nouvelle-Aquitaine;Vienne;Lecture / Conte;;;Sur inscription
Rencontre avec l'écrivain Jacques Houegbe;Venez rencontrer l'écrivain béninois Jacques Houegbe, actuellement en résidence à Bordeaux.;"Jacques Houegbe;rencontre d'auteur;résidence d'écriture;résidence d'écrivain;ALCA;Bénin;roman policier";Bibliothèque Mériadeck;33000;Bordeaux;Nouvelle-Aquitaine;Gironde;Rencontre d'auteur(s) et dédicace;;;Entrée libre
Lecture offerte;Plaisir de lire;;Collège Choiseul;37400;Amboise;Centre-Val de Loire;Indre-et-Loire;Partage de coups de cœur, conseils de lecture, « speed-booking »;11;14;Entrée libre
Lectures publiques;Lecture de Michèle Perret pour son roman et de Marie-Noël Arras pour la revue Etoiles d'encre;"Marie-Noël Arras;Michèle Perret;Etoiles d'encre";Espace L'autre livre;75005;Paris;Île-de-France;Paris;Lecture / Conte;;;Entrée libre
Appel à participation ! Racontez-nous votre « madeleine de Proust » !;Nous vous invitons à partager vos « madeleines de Proust »;;Médiathèque Saint-Vaast;62000;Arras;Hauts-de-France;Pas-de-Calais;Partage de coups de cœur, conseils de lecture, « speed-booking »;;;Entrée libre
Je peins avec les doigts;À la manière de Lucie Albon, venez peindre avec les empreintes de la main et donner forme à des paysages et personnages uniques.;atelier;Médiathèque Saint-Vaast;62000;Arras;Hauts-de-France;Pas-de-Calais;Atelier;;;Entrée libre
Dégustation de madeleines;Par l’atelier Cuisine du monde du Centre social Arras Ouest;;Médiathèque Saint-Vaast;62000;Arras;Hauts-de-France;Pas-de-Calais;Dégustation, buffet, collation…;;99;Entrée libre
On ne devrait écrire que des lettres d’amour;Cabaret chansons;;Médiathèque Saint-Vaast;62000;Arras;Hauts-de-France;Pas-de-Calais;Autre (précisez dans le champ ci-dessous);;99;Entrée libre
Lecture, danse, musique à l’ombre des jeunes filles en fleurs;Mots, notes ou pas de danse, écoutez et laissez vous séduire par la mélodie de l’écriture de Proust.;;Médiathèque Saint-Vaast;62000;Arras;Hauts-de-France;Pas-de-Calais;Spectacle (danse, concert, performance, théâtre…);;99;Entrée libre
Lectures publiques des livres de 13 éditeurs à l'Espace d'Autre Livre;lectures publiques de livres de 13 éditeurs par des auteurs et des comédiens;"Guillaume Basquin;Per Sorensen;Fawaz Hussain;Clément Charnier;Laure Sorasso;Claire Dumay;Fanny Saintenoy;Béatrice Tanaka;Françoise Favretto;Benoit Fourchard;Marie-Noël Arras;Jane Addams;Michèle Perret;Florent Papin;Jeanne Marie;Adelmo Venturelli";Espace L'autre livre;75005;Paris;Île-de-France;Paris;Lecture / Conte;16;99;Entrée libre
Lectures participatives et musicales;Lectures participatives et musicales;"Lectures;Théâtre;Musique";La Bastide L'Evêque;12200;Le Bas Ségala;Occitanie;Aveyron;Lecture / Conte;;;Entrée libre
Au cœur de la nuit - Immersion sonore et visuelle;De Patti Smith à Arthur H en passant par Gil Scott Heron, découvrez l'aspect poétique de la musique parlée. Espace : Auditorium Musique.;;Médiathèque centrale Emile Zola;34000;Montpellier;Occitanie;Hérault;Autre (précisez dans le champ ci-dessous);16;99;Entrée libre
Histoires en domino;Des lectures pour les 0-3 ans !;;Médiathèque Rhône Crussol;7500;Guilherand-Granges;Auvergne-Rhône-Alpes;Ardèche;Lecture / Conte;;3;Entrée libre
Des livres et des jeux;Et si vous jouiez avec vos personnages de contes favoris ?;;Bibliothèque municipale de Rochetrejoux;;;;;Soirée jeux (jeux de société, jeux vidéo, jeux d’évasion/escape game);2;99;Entrée libre
Boite de nuit;"Création de l'artiste plasticien normand Olivier Thiébaut qui cultive l'art insolite et poétique de la ""mise en boîte""";;Médiathèque de Fontaine-Étoupefour;14790;Fontaine-Étoupefour;Normandie;Calvados;Exposition;;;Entrée libre
Nuit de la lecture au CDI du lycée Fabert;Partez à la découverte de grands auteurs à travers divers ateliers proposés tout au long de la soirée.;lecture à voix haute / cadavres exquis / jeux littéraires;Lycée Fabert;57045;Metz;Grand Est;Moselle;Atelier;14;99;Sur inscription
Ma liberté à moi ! Lecture musicale en hommage à Toni Morrison;Traversées polyphoniques;Toni Morrison Nina Simone Lecture musicale Nuit de la lecture Poitiers Traversées The big Ticket to swing;Médiathèque François Mitterrand;86000;Poitiers;Nouvelle-Aquitaine;Vienne;Lecture / Conte;5;99;Entrée libre
Victor l’anecdoteur - adultes;Victor l’anecdoteur aime les histoires. Toutes les histoires, sous n’importe quelles formes… Contes, anecdotes, faits divers, proverbes, poèmes, lectures…;"contes;lecture;musée";Musée Alfred-Canel;27500;Pont-Audemer;Normandie;Eure;Lecture / Conte;7;99;Sur inscription
Dialogue autour  de Toni Morrison avec Christine Laferrière et Josyane Savigneau;Traversées Polyphoniques;Toni Morrison Poitiers Christine Laferrière Josyane Savigneau Lectures à voix haute Jazz;Médiathèque François Mitterrand;86000;Poitiers;Nouvelle-Aquitaine;Vienne;Conférence / table-ronde;15;99;Entrée libre
Le Goût des Autres;À l’affiche du Goût des Autres, cette année, la gourmandise, autant dire le plaisir de lire, de vivre, de partager et de découvrir des écrivains, en se montrant gourmand, épicurien et heureux.;;Bibliothèque Oscar Niemeyer;7660;Le Havre;Normandie;Seine-Maritime;Autre (précisez dans le champ ci-dessous);3;99;Entrée libre
La Nuit de la lecture : Lectures + Rencontre avec Thomas Scotto et Régis Lejonc  !;Lecture à voix haute + Séance de dédicaces;"Lecture;Nuit;Dédicace;Auteurs";Librairie Chat Perché;43000;Le Puy-en-Velay;Auvergne-Rhône-Alpes;Haute-Loire;Lecture / Conte;;;Entrée libre
La nuit porte conseil…de lectures !;A partir de l'horaire indiqué, les bibliothécaires vous proposent de partager leurs coups de cœur littéraires. Espace Littératures et Arts Adultes. Littérature et Arts Adultes;;Médiathèque centrale Emile Zola;34000;Montpellier;Occitanie;Hérault;Partage de coups de cœur, conseils de lecture, « speed-booking »;16;99;Entrée libre
Loup-garou;Le village de Thiercelieux est troublé par la présence d’un loup-garou qui rôde la nuit... sauvez votre peau ! Espace  : Salle de jeux.;;Médiathèque centrale Emile Zola;34000;Montpellier;Occitanie;Hérault;Partage de coups de cœur, conseils de lecture, « speed-booking »;10;16;Sur inscription
Lectures - expositions d'oeuvres inédites d'Edouard Daurelly;lectures - exposition   oeuvres inédites d'Edouard Daurelly;Lectures - Exposition;Bibliothèque municipale d'Ault;80460;Ault;Hauts-de-France;Somme;Lecture / Conte;;;Entrée libre
Lecture/rencontre avec un Florent Papin;"Florent Papin lira ""Payne""";"éditions la tête à l'envers;Florent Papin;Payne";Espace L'autre livre;75005;Paris;Île-de-France;Paris;Lecture / Conte;;;Entrée libre
Lecture/rencontre avec une traductrice;Jeanne Marie lira des poèmes en français et en espagnol qu'elle a traduits;"Garcia Lorca;Jeanne Marie";Espace L'autre livre;75005;Paris;Île-de-France;Paris;Lecture / Conte;;;Entrée libre
Teatime avec Anne Martinetti - Agatha Christie et la gourmandise;Crimes et gourmandises - Rencontre dégustation;"Agatha Christie;Anne Martinetti;Crimes;gourmandises;romans policiers;polars;Littérature policière;cuisine";Médiathèque Jacques Baumel;92500;Rueil-Malmaison;Île-de-France;Hauts-de-Seine;Rencontre d'auteur(s) et dédicace;10;99;Sur inscription
Escape Game Les Voyages fantastiques de Jules Verne;La Bibliothèque Universitaire de Lettres Lafayette propose un ensemble d’Escape Game autour de Jules Verne et de ses œuvres les plus connues. Trois missions de difficultés différentes seront à relever;"Escape gam;Jules Verne;Lecture;jeux;BU";Bibliothèque universitaire Lafayette;63000;Clermont-Ferrand;Auvergne-Rhône-Alpes;Puy-de-Dôme;Soirée jeux (jeux de société, jeux vidéo, jeux d’évasion/escape game);7;99;Sur inscription
Lectures à voix haute : première partie;Lectures à haute voix pour les grands de 19h à 23h;"lecture;conte;fable;récit;légende;apéro;convivialité;histoire;dormir debout";Bibliothèque municipale Jacqueline Weiss;60153;Rethondes;Hauts-de-France;Oise;Lecture / Conte;16;99;Entrée libre
Soirée pyjama;Mets-toi en pyjama, n’oublie pas ton doudou et viens écouter des histoires.;"lectures;jeunesse;pyjama";Médiathèque de Saint-Martin;29200;Brest;Bretagne;Finistère;Lecture / Conte;4;8;Sur inscription
Cruelles archives ! Venez écouter le récit de trois affaires criminelles qui ont retenti dans le Vaucluse;"""L'infâme Bedouin"", ""Fuyez cette femme"", ""Une éphémère évasion"" voici trois affaires criminelles qui ont retenti dans le Vaucluse";"lecture;archives;affaires criminelles";Archives départementales de Vaucluse;84000;Avignon;Provence-Alpes-Côte d'Azur;Vaucluse;Lecture / Conte;;;Sur inscription
Murder party;Un meurtre a été commis, résolvez l'enquête !;enquête;Centre Culturel Communautaire des Cordeliers;39000;Lons-le-Saunier;Bourgogne-Franche-Comté;Jura;Soirée jeux (jeux de société, jeux vidéo, jeux d’évasion/escape game);12;99;Sur inscription
Livre surprise;Apportez un livre et repartez avec un autre;"livres;cadeau;surprise";Médiathèque Coeur de Ville;94300;Vincennes;Île-de-France;Val-de-Marne;Partage de coups de cœur, conseils de lecture, « speed-booking »;;;Sur inscription
