Titre;Description;MotsClés;NomDuLieu;CodePostal;Ville;Région;Département;TypeEvénement;AgeMinimum;AgeMaximum;ConditionsDeParticipation
Lectures sur le thème de la nuit avec accompagnement musical;Lectures sur le thème de la nuit avec accompagnement musical;lecture nuit conteuse violoncelle musique;Bibliothèque municipale de Langeais;37130;Langeais;Centre-Val de Loire;Indre-et-Loire;Lecture / Conte;;;Sur inscription
Contes et comptines pour les bébés lecteurs;Contes pour les 0-4 ans;"Bébés lecteurs;Contes";Bibliothèque de Plémet;22210;Plémet;Bretagne;Côtes-d'Armor;Lecture / Conte;;4;Sur inscription
Exposition bocaux de lecture;fiche de lecture sous forme de bocaux;;CDI du collège Roland Vaudatin;50450;Gavray;Normandie;Manche;Exposition;;;Entrée libre
Lectures ouvertes;Scène ouverte de lectures;coup de coeur;Médiathèque de Saint-Clément;89100;Saint-Clément;Bourgogne-Franche-Comté;Yonne;Partage de coups de cœur, conseils de lecture, « speed-booking »;6;99;Sur inscription
Lecture à plusieurs voix;Lecture de contes à plusieurs voix;"Contes;Marcel Aymé";Médiathèque de Saint-Clément;89100;Saint-Clément;Bourgogne-Franche-Comté;Yonne;Lecture / Conte;;99;Entrée libre
"Atelier d'écriture ""Dans ma maison""";Atelier d’écriture et mise en forme;"écriture;Poésie;jeu;atelier;lecture;Grand-Est;Marne;Reims;Tinqueux";Centre Culturel, Centre de Créations pour l'Enfance;51430;Tinqueux;Grand Est;Marne;Atelier;7;99;Entrée libre
Le poème est dedans;Le Poème est dedans ou lire la poésie aux bébés, pendant toute leur vie. Documentaire poétique;"Poésie;Marne;Reims;Tinqueux;Gratuit;Enfants;Bébés;Adultes;Littérature;DRAC;ARS;Grand-Est;Documentaire";Centre Culturel, Centre de Créations pour l'Enfance;51430;Tinqueux;Grand Est;Marne;Projection;;99;Entrée libre
À la recherche du conte perdu;Jeu de piste;Jeu Mille et une nuits Contes;Médiathèque George Sand;28110;Lucé;Centre-Val de Loire;Eure-et-Loir;Soirée jeux (jeux de société, jeux vidéo, jeux d’évasion/escape game);12;99;Entrée libre
Rencontre de créatures mythiques et imaginaires de la littérature;Dans les pas des créatures de contes et de la mythologie;"mythologie;énigmes;jeux;histoires";Bibliothèque Simone-Lagrange - Mi-Plaine;38240;Meylan;Auvergne-Rhône-Alpes;Isère;Soirée jeux (jeux de société, jeux vidéo, jeux d’évasion/escape game);;99;Entrée libre
Lecture musicale;Lecture musicale des nouvelles de Serge Pey, lues par Roland Gigoi et accompagnées à la guitare et au chant par Kiko Ruiz (proposée par Entresort Théâtre).;lecture;Médiathèque Tournefeuille;31170;Tournefeuille;Occitanie;Haute-Garonne;Lecture / Conte;;;Sur inscription
Atelier de doublage;Offrez votre voix au héros d'un film d'animation !;"atelier;doublage";Bibliothèque municipale de Trouville-sur-Mer;14360;Trouville-sur-Mer;Normandie;Calvados;Atelier;;;Entrée libre
Rencontre avec Pascal Légitimus;rencontre et dédicace avec Pascal Légitimus;"dédicace;humour";Bibliothèque municipale de Trouville-sur-Mer;14360;Trouville-sur-Mer;Normandie;Calvados;Rencontre d'auteur(s) et dédicace;;;Entrée libre
Cris et chuchotements : le Blablatour;"Entre ""cris et chuchotements"", venez passez votre soirée à la bibliothèque";visite décalée;Médiathèque La Pléiade;44150;Ancenis;Pays de la Loire;Loire-Atlantique;Visite guidée / visite insolite;;99;Entrée libre
Cris et chuchotements avec les Diables de TasmaNantes;"Entre ""cris et chuchotements"", venez passer votre soirée à la bibliothèque";théâtre d'improvisation;Médiathèque La Pléiade;44150;Ancenis;Pays de la Loire;Loire-Atlantique;Spectacle (danse, concert, performance, théâtre…);;99;Entrée libre
Partages de lectures à voix hautes pour adultes/ados;Lectures de textes courts;"lecture à voix haute;découverte de textes.";Médiathèque intercommunale du pays de Mirepoix;9500;Mirepoix;Occitanie;Ariège;Lecture / Conte;;;Entrée libre
Soirée lectures croisées polars;Lectures croisées;"Polar;Ateliers d'écriture;Lectures croisées;Auteur;Repas;Association";La Boutique d'écriture;34967;Montpellier;Occitanie;Hérault;Lecture / Conte;16;99;Entrée libre
Déambulation et soirée jeux dans votre médiathèque/ludothèque;Cette soirée sera aussi l'occasion de découvrir en famille votre médiathèque-ludothèque autrement;"déambulation;jeux de société";Médiathèque intercommunale de Labastide St Pierre;82370;Labastide-Saint-Pierre;Occitanie;Tarn-et-Garonne;Soirée jeux (jeux de société, jeux vidéo, jeux d’évasion/escape game);;;Entrée libre
Le campement à histoires;Découvre les livres CD de la médiathèque à l'abris dans ta tente...;"conte;histoire;cd";Médiathèque Armel de WIsmes-Pornic;44210;Pornic;Pays de la Loire;Loire-Atlantique;Lecture / Conte;;;Entrée libre
Concert rock par les élèves de l’Ecole municipale de musique;Reprises rock par l’atelier des musiques actuelles de l’Ecole de musique;"concert;rock";Médiathèque Condorcet;44340;Bouguenais;Pays de la Loire;Loire-Atlantique;Spectacle (danse, concert, performance, théâtre…);;;Entrée libre
Rencontre à l'aveugle avec un livre;Découvrir les livres cachés sous un emballage;"blind;date;book";Médiathèque Armel de WIsmes-Pornic;44210;Pornic;Pays de la Loire;Loire-Atlantique;Partage de coups de cœur, conseils de lecture, « speed-booking »;;;Entrée libre
Petites histoires d'amitié;Une ambiance feutrée et de petites histoires dans lesquelles l'amitié et l'entraide vont sauver bien des situations...;"histoires;contes;enfants";Médiathèque Ti ar geriou;29290;Saint-Renan;Bretagne;Finistère;Lecture / Conte;6;10;Sur inscription
Escape game avec jeux et énigmes;"Animation ludique ""le cadenas magique et ses énigmes""";;Ancienne école;88260;Thuillières;Grand Est;Vosges;Soirée jeux (jeux de société, jeux vidéo, jeux d’évasion/escape game);8;16;Entrée libre
Animations ludiques autour de la lecture et des mots;Venez passer un bon moment en famille;;Salle polyvalente;88500;Gircourt-lès-Viéville;Grand Est;Vosges;Autre (précisez dans le champ ci-dessous);;;Entrée libre
Soirée Lecture au CDI;Soirée lecture à destination des collégiens et de leurs parents. Découverte du CDI du collège Pierre Valdo, présentation d'une sélection de livres, mise en voix de textes par les collégiens.;"lecture;spectacle;haïku;rencontre";Collège Pierre Valdo;69120;Vaulx-en-Velin;Auvergne-Rhône-Alpes;Métropole de Lyon;Lecture / Conte;;99;Entrée libre
Lecture à voix haute;Morceaux choisis de romans lus à voix haute;;Médiathèque du Ponton;49170;La Possonnière;Pays de la Loire;Maine-et-Loire;Lecture / Conte;;;Entrée libre
Tours de magie spécial Harry Potter !;Tours de magie en close up sur le thème d'Harry Potter;"Harry Potter;magie";Médiathèque du Thillot;88160;Le Thillot;Grand Est;Vosges;Spectacle (danse, concert, performance, théâtre…);;;Entrée libre
Lectures à voix haute;Lectures à voix haute par les Petits champions de la lecture de la classe de Mme Pouget (CM Ecole J. Baker);"lecture;Petits champions de la lecture";Médiathèque Les Granges;31240;Saint-Jean;Occitanie;Haute-Garonne;"Animation ""Petits champions de la lecture""";;;Entrée libre
La Noiraude fête ses 20 ans ! Lectures à voix haute;Fonds spécialisé de nouvelles noires et policières, la Noiraude se joint à la Nuit de la lecture.;"noiraude;nouvelle noire;pordic;nuit de la lecture;lectures";Médiathèque de l'Ic;22590;Pordic;Bretagne;Côtes-d'Armor;Lecture / Conte;;;Entrée libre
Kahalim l'Opulent;"Lecture contée méditative proposée par la compagnie ""Le Cercle aux Histoires"" de Colmar. Interprétation : Sandrine Mahler. Musique : Timothée Bour-Mahler.";"lecture;contée;méditatif;méditation;musique;relaxation";Médiathèque Communautaire de Sarreguemines;57200;Sarreguemines;Grand Est;Moselle;Lecture / Conte;6;99;Entrée libre
Le Yark;Lecture avec projection (à partir de 7 ans);"lecture;projection";Médiathèque Communautaire de Sarreguemines;57200;Sarreguemines;Grand Est;Moselle;Lecture / Conte;7;12;Entrée libre
1/4 h lecture;1/4 h lecture proposée dans chaque classe tout au long de la journée de jeudi. Les lecteurs sont des élèves ou des adultes volontaires.;;CDI du collège Vincent Rotinat;36230;Neuvy-Saint-Sépulchre;Centre-Val de Loire;Indre;Lecture / Conte;10;15;Entrée libre
Jeu de piste littéraire;5 énigmes littéraires avec des indices dans tout le collège pour retrouver des personnages célèbres de la littérature jeunesse.;;CDI du collège Vincent Rotinat;36230;Neuvy-Saint-Sépulchre;Centre-Val de Loire;Indre;Concours;;;Entrée libre
Voyage lecture avec 1,2,3 albums;Venez découvrir 1,2,3 albums et une de ses lectures épicées...;;Médiathèque La Grenette;1500;Ambérieu-en-Bugey;Auvergne-Rhône-Alpes;Ain;Lecture / Conte;11;99;Entrée libre
Soirée conviviale autour de vos lectures coup de coeur;Soirée lecture;"lectures;coups de coeur;soirée;convivialité";Lycée polyvalent George Sand;36400;La Châtre;Centre-Val de Loire;Indre;Partage de coups de cœur, conseils de lecture, « speed-booking »;;;Sur inscription
Samedi, la Nuit à Maury IV : projection-conférence naturaliste;Observer, découvrir, les espèces locales sous le regard de Jacques Miot, naturaliste installé au Caunil, commune de Lapradelle.;"NATURALISME;droits des animaux;JACQUES MIOT;observation;description;rapprochement entre humains et animaux;concentration;respiration";Salle du conseil municipal;66460;Maury;Occitanie;Pyrénées-Orientales;Conférence / table-ronde;;121;Entrée libre
Lecture : les contes de la petite fille moche;Lecture à voix haute par l'auteur et metteur en scène Julien Daillère.;;Médiathèque de Saint-Genis-les-Ollières;69290;Saint-Genis-les-Ollières;Auvergne-Rhône-Alpes;Métropole de Lyon;Lecture / Conte;;;Entrée libre
Soupe;Dégustation de soupe;soupe;Bibliothèque Grand'Rue;68100;Mulhouse;Grand Est;Haut-Rhin;Dégustation, buffet, collation…;;99;Entrée libre
Rencontre exceptionnelle avec Ian McEwan;La Bibliothèque historique ouvre ses portes pour une rencontre exceptionnelle avec l’auteur britannique Ian McEwan.;;Bibliothèque historique de la Ville de Paris;75004;Paris;Île-de-France;Paris;Rencontre d'auteur(s) et dédicace;;;Sur inscription
Décore la médiathèque;Participe à la décoration de la médiathèque à l'occasion de la Nuit de la lecture;"Atelier;atelier créatif;création;décoration;étoile;papier";Médiathèque Jean-Monnet;92270;Bois-Colombes;Île-de-France;Hauts-de-Seine;Atelier;;99;Entrée libre
Lecture en pyjama, avec ou sans doudou !;Lecture d'histoires en pyjama, avec son doudou ou comme un(e) grand(e)...;"lecture;doudou;pyjama";Bibliothèque municipale Georges Duhamel;95290;L'Isle-Adam;Île-de-France;Val-d'Oise;Lecture / Conte;4;7;Sur inscription
La Nuit à Violette : cabaret littéraire;Cabaret littéraire;;Médiathèque Violette Leduc;75011;Paris;Île-de-France;Paris;Spectacle (danse, concert, performance, théâtre…);;;Entrée libre
Lettres à L, à G, à mon loup, à maman, à tante L, à monsieur et madame P et à nous;Lecture de lettres issues du centre de tri de La Poste à Libourne qui traite les courriers qui n’ont pas atteint leur destinataire, faute d’adresse correctement libellée. Projet d’Adrianna Wallis.;"Lecture;Lettres perdues;Correspondance;Mémoire;Archives nationales;Grands dépôts;Adrianna Wallis";Archives nationales - musée;75003;Paris;Île-de-France;Paris;Lecture / Conte;9;99;Entrée libre
Ta page nocturne : histoires pour enfants;Contes et jeux pour enfants;"contes;jeux de société";Bibliothèque Pablo Neruda - Grand-Pré;38240;Meylan;Auvergne-Rhône-Alpes;Isère;Lecture / Conte;;8;Entrée libre
Ta page nocturne : slam avec Medhi Dix;Pour la deuxième partie de la soirée, le slameur Medhi Dix vous propose son spectacle, tout en mots et en poésie.;"contes;jeux de société;atelier d'écriture";Bibliothèque Pablo Neruda - Grand-Pré;38240;Meylan;Auvergne-Rhône-Alpes;Isère;Spectacle (danse, concert, performance, théâtre…);;99;Entrée libre
Contes kamishibaï;Théâtre d'images;;Bibliothèque de Breil-sur-Roya;6540;Breil-sur-Roya;Provence-Alpes-Côte d'Azur;Alpes-Maritimes;Lecture / Conte;;;Entrée libre
Récitations et lectures de poésie;Récitation de poésies et de beaux textes;"poésie;récitation";Bibliothèque municipale de Feucherolles;78810;Feucherolles;Île-de-France;Yvelines;Lecture / Conte;;99;Entrée libre
Lecture à voix haute d’extraits des Mille et une nuits;Lecture à voix haute d’extraits des Mille et une nuits à la médiathèque Centre-ville Saint-Denis - Plaine Commune;"contes;lecture d'histoires;lecture à voix haute";Médiathèque Centre Ville;93200;Saint-Denis;Île-de-France;Seine-Saint-Denis;Lecture / Conte;6;99;Entrée libre
Lectures numériques;Lectures sur tablette en famille;;Médiathèque Louis Aragon;72100;Le Mans;Pays de la Loire;Sarthe;Lecture / Conte;;;Entrée libre
Autour du monde : sur les traces de Philéas Fogg;Jeu de piste en famille, dès 6 ans;;Médiathèque Louis Aragon;72100;Le Mans;Pays de la Loire;Sarthe;Soirée jeux (jeux de société, jeux vidéo, jeux d’évasion/escape game);;;Entrée libre
Tous azimuts !;Quizz pour toute la famille, tous genres confondus;;Médiathèque Louis Aragon;72100;Le Mans;Pays de la Loire;Sarthe;Soirée jeux (jeux de société, jeux vidéo, jeux d’évasion/escape game);;;Entrée libre
Petites musiques de nuit;Voyage musical en compagnie du Conservatoire;;Médiathèque Louis Aragon;72100;Le Mans;Pays de la Loire;Sarthe;Spectacle (danse, concert, performance, théâtre…);;;Entrée libre
Lectures célestes - « lecture » du ciel commentée;Mission Apollo : exposition et lectures;"lecture;adulte;adolescent;ciel";Médiathèque Colette;91090;Lisses;Île-de-France;Essonne;Visite guidée / visite insolite;;;Sur inscription
Parfum de scandale au second;Les plus gros scandales de la vie littéraire et du cinéma;"scandale;littérature;cinéma";Médiathèque Gaston Baissette;34130;Mauguio;Occitanie;Hérault;Soirée jeux (jeux de société, jeux vidéo, jeux d’évasion/escape game);;;Entrée libre
Les instantanés littéraires des bibliothécaires;Lecture;"lectures;apéro";Médiathèque Romain Rolland;93230;Romainville;Île-de-France;Seine-Saint-Denis;Lecture / Conte;12;99;Entrée libre
Lecture de textes courts et spectacle autour des Fables de la Fontaine;Lecture à haute voix de textes courts, humoristiques ou poétiques et spectacle autour des Fables de La Fontaine;;Maison des Associations;94240;L'Haÿ-les-Roses;Île-de-France;Hauts-de-Seine;Lecture / Conte;5;99;Entrée libre
Histoires à dévorer;Lecture à voix haute pour les 2-5 ans, suivie d'un goûter;;Bibliothèque Gérard Philipe;76580;Le Trait;Normandie;Seine-Maritime;Lecture / Conte;2;5;Entrée libre
Escape game;Venez vous échapper du piège diabolique !;;Bibliothèque Municipale de Helfrantzkirch;68510;Helfrantzkirch;Grand Est;Haut-Rhin;Soirée jeux (jeux de société, jeux vidéo, jeux d’évasion/escape game);14;99;Sur inscription
Escape game version famille;Escape game à la bilbiothèque;;Bibliothèque Municipale de Helfrantzkirch;68510;Helfrantzkirch;Grand Est;Haut-Rhin;Soirée jeux (jeux de société, jeux vidéo, jeux d’évasion/escape game);;99;Sur inscription
Atelier dessins de bandes dessinées;"Atelier ""De la lecture au dessins""";dessins / bande dessinée / planche/ artiste;Bibliothèque municipale du Nouvion-en-Thiérache;2170;Le Nouvion-en-Thiérache;Hauts-de-France;Aisne;Atelier;6;99;Sur inscription
Apéro BD;Venez découvrir la sélection BD proposée par Sylvain, libraire;"Echanges autour de la BD;Coups de coeur en bande dessinée;Sélection BD Angoulême 2020";Médiathèque Blaise Cendrars;78700;Conflans-Sainte-Honorine;Île-de-France;Yvelines;Partage de coups de cœur, conseils de lecture, « speed-booking »;15;99;Entrée libre
La diseuse de bonne lecture;Mme Soleil et sa boule de cristal vous conseillerons des livres sur-mesure;"conseil;atypique;mystère";Bibliothèque municipale de Nemours;77140;Nemours;Île-de-France;Seine-et-Marne;Partage de coups de cœur, conseils de lecture, « speed-booking »;;;Entrée libre
Présence d'écrivains locaux;Présence d'écrivains locaux, exposition peinture, sculpture, etc. Lectures à voix haute;Bibliothèque;Bibliothèque municipale de Thil;1120;Thil;Auvergne-Rhône-Alpes;Ain;Rencontre d'auteur(s) et dédicace;;;Entrée libre
Autour du Manga : L'équipe Z;« L’équipe Z : le manga de foot bordelais » en 20 panneaux;"Manga;foot;bordelais";Salle des fêtes d'Izon;33450;Izon;Nouvelle-Aquitaine;Gironde;Exposition;;;Entrée libre
"Animation ""Petits champions de la lecture""";Premier tour des petits champions de la lecture avec intermèdes musicaux;;Médiathèque Centre Corse;20250;Corte;Corse;Haute-Corse;"Animation ""Petits champions de la lecture""";;;Sur inscription
Light painting;Atelier;lightpainting;Médiathèque Simone Veil;94140;Alfortville;Île-de-France;Val-de-Marne;Atelier;8;99;Sur inscription
Vincent Tomasset, invité de la Nuit de la lecture;Vincent Thomasset, artiste en résidence au POC invité de la Nuit de la lecture.;Lectures ateliers d'écriture;Médiathèque Simone Veil;94140;Alfortville;Île-de-France;Val-de-Marne;Rencontre d'auteur(s) et dédicace;8;99;Entrée libre
Déambulations nocturnes;Lectures du club de théâtre;Club de théâtre;Médiathèque Simone Veil;94140;Alfortville;Île-de-France;Val-de-Marne;Lecture / Conte;10;99;Entrée libre
Escape Game : le fantôme de l'opéra;Promenez-vous à l'intérieur de l'EMA et cherchez, à l'aide des indices musicaux et littéraires le fantôme qui s'y cache!;"jeu;musique;littérature";Médiathèque municipale de Languidic;56440;Languidic;Bretagne;Morbihan;Soirée jeux (jeux de société, jeux vidéo, jeux d’évasion/escape game);;;Entrée libre
La nuit Zen & Lettres - Conférence;Ressentis, émotions, mon corps me parle. Et si je l'écoutais ? Par Yolande Bourillot, thérapeute.;;Médiathèque La mine des mots;13530;Trets;Provence-Alpes-Côte d'Azur;Bouches-du-Rhône;Conférence / table-ronde;14;99;Sur inscription
Lecture musicale;Venez découvrir la création de la compagnie 7ème SOL: une lecture musicale du roman noir de Franck Bouysse, “Né d’aucune femme”;"lecture;musique;Franck Bouysse;Né d'aucune femme;Compagnie 7ème SOL";La Centrale, Bibliothèque Hybride;33260;La Teste-de-Buch;Nouvelle-Aquitaine;Gironde;Lecture / Conte;18;99;Entrée libre
Histoires et chocolat chaud;Une heure du conte pour les petits. Et une dégustation de chocolat chaud pour petits et grands. Doudous et couvertures acceptés.;"Histoires;tout-petits;chocolat chaud;contes;lectures";Médiathèque Joëlle Brière;89510;Véron;Bourgogne-Franche-Comté;Yonne;Lecture / Conte;1;8;Entrée libre
Moment de Partage;Partager son coups de coeur;Partage;Médiathèque des Cannes;20090;Ajaccio;Corse;Corse-du-Sud;Partage de coups de cœur, conseils de lecture, « speed-booking »;;;Entrée libre
Café littéraire;Partage d'ouvrages et lectures;"lectures;partage";Restaurant Lypocan;88260;Lerrain;Grand Est;Vosges;Partage de coups de cœur, conseils de lecture, « speed-booking »;;;Entrée libre
Escape game à la bibliothèque -jeune public;Saurez-vous résoudre l'énigme en moins d'une heure ?;Escape game;Bibliothèque municipale de Prévessin-Moëns;1280;Prévessin-Moëns;Auvergne-Rhône-Alpes;Ain;Soirée jeux (jeux de société, jeux vidéo, jeux d’évasion/escape game);8;12;Sur inscription
"Salon des impatients - Atelier ""l'histoire des tuiles de l'Abd el Kader"" - MERCREDI 15 janvier";Ateliers d'écriture pour lecture partagée;"lecture;exposition;atelier écriture";Maison de quartier du stade;71100;Chalon-sur-Saône;Bourgogne-Franche-Comté;Saône-et-Loire;Atelier;8;99;Sur inscription
Escape Game;3 équipes de 5 personnes pour résoudre l'énigme !;Escape Game;Médiathèque municipale François Mitterrand;58500;Clamecy;Bourgogne-Franche-Comté;Nièvre;Soirée jeux (jeux de société, jeux vidéo, jeux d’évasion/escape game);15;99;Sur inscription
Soupe partagée;Une bonne soupe pour se réchauffer !;soupe partage;Médiathèque municipale François Mitterrand;58500;Clamecy;Bourgogne-Franche-Comté;Nièvre;Dégustation, buffet, collation…;;;Entrée libre
Histoires du soir;Profiter de votre médiathèque autrement;"casque VR;Quiz;Lectures;Contes;Buffet participatif";Médiathèque de Lencloître;86140;Lencloître;Nouvelle-Aquitaine;;Lecture / Conte;3;99;Entrée libre
Lectures et contes;Première Nuit de la lecture à Sauxillanges. Des lectures et contes pour grands et petits vous seront proposés. Vous pourrez également participer à des jeux.;"lecture;conte;jeux";Bibliothèque de Sauxillanges;63490;Sauxillanges;Auvergne-Rhône-Alpes;Puy-de-Dôme;Lecture / Conte;;;Entrée libre
Soirée jeux;Première Nuit de la lecture à Sauxillanges. Des lectures et contes pour grands et petits vous seront proposés. Vous pourrez également participer à des jeux.;"lecture;conte;jeux";Bibliothèque de Sauxillanges;63490;Sauxillanges;Auvergne-Rhône-Alpes;Puy-de-Dôme;Soirée jeux (jeux de société, jeux vidéo, jeux d’évasion/escape game);;;Entrée libre
Lectures en direct sur les ondes de Radio Alto;Radio Alto ouvre son studio et ses ondes à tout lecteur ou lectrice intéressé(e) par des lectures tout au long de la nuit.;"radio;lecture;musique";Radio Alto;73340;Lescheraines;Auvergne-Rhône-Alpes;Savoie;Autre (précisez dans le champ ci-dessous);;;Entrée libre
"Nuit fantastique à Angers - ""Enquête à la BU""";Enquête, buffet suivi d'une rencontre et concert !;"angers;bibliothèque;livre;lecture;auteur;rencontre;enquête;inzani;concert;musique;fantastique;Université;BU;UCO";Bibliothèque universitaire de l'Université catholique de l'Ouest;;Angers;Pays de la Loire;Maine-et-Loire;Soirée jeux (jeux de société, jeux vidéo, jeux d’évasion/escape game);;;Sur inscription
Un bonbon sur la langue;Jeu de lecture;jeu lecture;Médiathèque André Baudon;12340;Bozouls;Occitanie;Aveyron;Soirée jeux (jeux de société, jeux vidéo, jeux d’évasion/escape game);;;Entrée libre
Conte musical : le Blues de la Grenouille;Comment les blessures narcissiques d’une petite grenouille peuvent générer un cataclysme écologique ?;"conte;blues;guitare;spectacle;enfants";Médiathèque Verneuil-sur-Seine;78480;Verneuil-sur-Seine;Île-de-France;Yvelines;Lecture / Conte;5;121;Sur inscription
Rencontre d'auteurs locaux;Rencontre et dédicace avec des auteurs locaux;"livre;auteur;partage;découverte;discussions;dédicaces;histoire;trains";Médiatheque de Givors;69700;Givors;Auvergne-Rhône-Alpes;Métropole de Lyon;Rencontre d'auteur(s) et dédicace;;;Entrée libre
Une nuit à la plage;Pour faire un plongeon dans la lecture (à partir de 19h), salle des albums;"livre;jeunesse;Plage;Nuit;Transat;Sable;Piscine;enfants;famille";Médiatheque de Givors;69700;Givors;Auvergne-Rhône-Alpes;Métropole de Lyon;Lecture / Conte;;;Entrée libre
Atelier d'écriture;ATELIER D'ECRITURE;"Atelier;Ecriture;Marieke Hazard";Médiathèque Kalliopê;34480;Magalas;Occitanie;Hérault;Atelier;14;99;Sur inscription
Raconte-moi tes trésors…;Découverte originale des trésors de la bibliothèque;;Bibliothèques de Nancy - Bibliothèque Stanislas;54100;Nancy;Grand Est;Meurthe-et-Moselle;Lecture / Conte;;;Entrée libre
KODHJA - Lecture dessinée;Lecture dessinée.;"lecture;dessin;spectacle";Maison Pour Tous de Chadrac;43770;Chadrac;Auvergne-Rhône-Alpes;Haute-Loire;Lecture / Conte;8;99;Sur inscription
La Nuit de la Lecture à Amiens;Dédicace de David Périmony;"dedicaces;librairie independante;amiens;dessin;bande dessinée;perimony";Librairie Bulle en stock;80000;Amiens;Hauts-de-France;Somme;Rencontre d'auteur(s) et dédicace;;99;Entrée libre
Musique jusqu'au bout de la nuit : scène ouverte;Scène ouverte;;Médiathèque - Espace culturel Robert Hossein;59660;Merville;Hauts-de-France;Nord;Spectacle (danse, concert, performance, théâtre…);;;Sur inscription
Escape Game;13 séances pour cet escape game !;;Bibliothèque de Bischoffsheim;67870;Bischoffsheim;Grand Est;Bas-Rhin;Soirée jeux (jeux de société, jeux vidéo, jeux d’évasion/escape game);9;99;Sur inscription
Blind Test;Trouvez les musiques de films policiers;;Médiathèque Josselmann de Rosheim;67560;Rosheim;Grand Est;Bas-Rhin;Soirée jeux (jeux de société, jeux vidéo, jeux d’évasion/escape game);8;99;Entrée libre
Pause lecture spécial Polars;Le polar dans tous ses états;;Bibliothèque de Rosenwiller;67560;Rosenwiller;Grand Est;Bas-Rhin;Lecture / Conte;8;99;Entrée libre
Heure du conte en pyjama;La bibliothèque de Gondreville attend les enfants en pyjama pour écouter des histoires ...;"heure du conte;pyjama;numérique";Bibliothèque de Gondreville;54840;Gondreville;Grand Est;Meurthe-et-Moselle;Lecture / Conte;;;Entrée libre
Dédicace de roman;Dédicace par l'auteure à partir de 14h30;"dédicace;roman";Bibliothèque de Cologne;32430;Cologne;Occitanie;Gers;Rencontre d'auteur(s) et dédicace;;;Entrée libre
Blindtest Vintage;Quiz musical;"quiz;musique;chansons;musiciens;jeu;convivialité";Bibliothèque de Sailly-sur-la-Lys;62840;Sailly-sur-la-Lys;Hauts-de-France;Pas-de-Calais;Soirée jeux (jeux de société, jeux vidéo, jeux d’évasion/escape game);;;Sur inscription
Enquête à la médiathèque;Enquête à la médiathèque;jeu d'enquête;Médiathèque Jacques Dupin;7000;Privas;Auvergne-Rhône-Alpes;Ardèche;Soirée jeux (jeux de société, jeux vidéo, jeux d’évasion/escape game);9;121;Sur inscription
Atelier marque page musical;Un conte impliquant un instrument de musique;;Bibliothèque de Fleurbaix;62840;Fleurbaix;Hauts-de-France;Pas-de-Calais;Atelier;;;Entrée libre
Jam Intermède musical amateur;Improvisation musicale avec les volontaires;;Bibliothèque de Fleurbaix;62840;Fleurbaix;Hauts-de-France;Pas-de-Calais;Spectacle (danse, concert, performance, théâtre…);;;Entrée libre
