Titre;Description;MotsClés;NomDuLieu;CodePostal;Ville;Région;Département;TypeEvénement;AgeMinimum;AgeMaximum;ConditionsDeParticipation
Spectacle Panique à Cocotte-Ville;Une fable écologique dès 3 ans, où l'action côtoie l'humour et l'émotion, dans un univers musical et rythmé.;"spectacle;tout public;écologie;famille";Salle des fêtes Vicq-sur-Breuilh;87260;Vicq-sur-Breuilh;Nouvelle-Aquitaine;Haute-Vienne;Spectacle (danse, concert, performance, théâtre…);3;99;Entrée libre
Lecture : Premier amour, de Samuel Beckett;Pour cette nouvelle Nuit de la lecture qui se tiendra dans notre belle chapelle Saint-Patrick, le comédien Théophile Choquet fera entendre Premier amour, de Samuel Beckett.;"lecture;Irlande";Centre culturel Irlandais;75005;Paris;Île-de-France;Paris;Lecture / Conte;;;Sur inscription
Rencontre avec les auteurs agathois;auteurs de la ville ou sur la ville d'Agde;"rencontre;dédicace";Maison du Coeur de Ville;34300;Agde;Occitanie;Hérault;Rencontre d'auteur(s) et dédicace;;;Entrée libre
La chasse aux livres;Découvrir la libraire et des pépites grâce au jeu de piste dans les livres jeunesse et adulte de la librairie;"librairie;jeu de piste;familial";Librairie Histoires sans fin;74800;La Roche-sur-Foron;Auvergne-Rhône-Alpes;Haute-Savoie;Soirée jeux (jeux de société, jeux vidéo, jeux d’évasion/escape game);6;99;Entrée libre
Lettre à l'auteur;Livres d'or destinés à nos auteurs jeunesse préférés;jeunesse;Collège Les Hauts Grillets;78100;Saint-Germain-en-Laye;Île-de-France;Yvelines;Autre (précisez dans le champ ci-dessous);10;99;Sur inscription
Soirée des livres documentaires !;Venez jouer avec les documentaires ! Quinze questions dont la réponse se trouvent dans les livres. A vous de les retrouver !;"documentaires;recherche;livres;enquête";Centre Culturel Condorcet;2240;Itancourt;Hauts-de-France;Aisne;Soirée jeux (jeux de société, jeux vidéo, jeux d’évasion/escape game);6;17;Entrée libre
La galerie des Nobel;Exposition sur les Nobel emblématiques de la littérature en langue française, chinois, anglaise, allemande, italienne et polonaise;"exposition;Nobel";Collège Les Hauts Grillets;78100;Saint-Germain-en-Laye;Île-de-France;Yvelines;Exposition;10;99;Sur inscription
Soirée lecture douillette en famille... Chouette, c'est la nuit !;Chouette, c’est la nuit !;"Lecture à haute voix;Douillette;Balade nocturne;Mystère;Chouette;à l'aise;Zen;Soupe;Famille";La Balade des Livres - Villa Beauséjour;35000;Rennes;Bretagne;Ille-et-Vilaine;Lecture / Conte;5;99;Sur inscription
"Raconte-tapis ""Loup, quelle grosse bête""";Lecture d'histoires de loups.;"raconte-tapis;loups";Médiathèque municipale Frantz et Quenault;51140;Jonchery-sur-Vesle;Grand Est;Marne;Lecture / Conte;;;Entrée libre
Si par une nuit d'hiver on voyageait ?;Lectures nocturnes sous le signe du voyage;"Lectures;voyages;nocturne";Bibliothèque municipale Internationale;38000;Grenoble;Auvergne-Rhône-Alpes;Isère;Lecture / Conte;;;Entrée libre
Contes ? Raconte !;Contes ? Raconte !Spectacle de contes. Pour les enfants à partir de 5 ans.;;Médiathèque du Centre-ville d'Ivry;94200;Ivry-sur-Seine;Île-de-France;Val-De-Marne;Lecture / Conte;5;10;Entrée libre
Remise des prix aux Petits Champions de la Lecture;Remise des prix et des diplômes : Les Petits Chamions de la Lecture;"les petits champions de la lecture;concours de lecture à voix haute";Espace François Mitterrand;13190;Allauch;Provence-Alpes-Côte d'Azur;Bouches-du-Rhône;"Animation ""Petits champions de la lecture""";5;99;Entrée libre
"Héros et super héros de la BD; rencontre d'auteurs et dédicace";Rencontre d'auteurs BD et dédicaces;;Espace François Mitterrand;13190;Allauch;Provence-Alpes-Côte d'Azur;Bouches-du-Rhône;Rencontre d'auteur(s) et dédicace;5;99;Entrée libre
Le dernier amour de Baba Dounia, lecture intégrale;Lecture collective et intégrale du roman d'Alina Bronsky Le dernier amour de Baba Dounia;"lecture intégrale;lecture à voix haute;lecture collective;Roman;Russie;viellesse;Sagesse;Fantaisie;solidarité;tendresse";Médiathèque Les Mots Passants;25410;Saint-Vit;Bourgogne-Franche-Comté;Doubs;Lecture / Conte;12;99;Entrée libre
"Dans la nuit des racontars glacés, spectacle  ""Racontars arctiques""";"Dans la nuit des racontars glacés, ""Racontars arctiques""";"spectacle;théâtre;hiver;pôle nord;trappeur";Médiathèque municipale de Nailloux;31560;Nailloux;Occitanie;Haute-Garonne;Spectacle (danse, concert, performance, théâtre…);10;99;Sur inscription
1, 2, 3... cueillez des histoires;Contes et comptines;"contes;comptines";Bibliothèque municipale de Quetigny;21800;Quetigny;Bourgogne-Franche-Comté;Côte-d'Or;Lecture / Conte;2;6;Entrée libre
Sacs surprises;Collation et distribution de sacs surprises;;Bibliothèque municipale de Vasperviller;57560;Vasperviller;Grand Est;Moselle;Dégustation, buffet, collation…;;;Entrée libre
"Spectacle d'improvisation : ""Pioche !""";Spectacle d'improvisation en famille pour une veillée pyjama en famille.;"spectacle;enfant;improvisation";Médiathèque municipale;69330;Meyzieu;Auvergne-Rhône-Alpes;Métropole de Lyon;Spectacle (danse, concert, performance, théâtre…);;;Sur inscription
Repas partagé - zéro déchet !;Chacun amène un petit plat salé ou sucré à partager;;Médiathèque B612;69230;Saint-Genis-Laval;Auvergne-Rhône-Alpes;Métropole de Lyon;Dégustation, buffet, collation…;;;Entrée libre
Jeux vidéo;Des jeux vidéo d’aventure dans l’espace.;jeu vidéo;Médiathèque Le Trente;38200;Vienne;Auvergne-Rhône-Alpes;Isère;Atelier;;;Entrée libre
Matinée contée;Matinée contée;"matinée;contes;jeunesse";Médiathèque de Locminé;56500;Locminé;Bretagne;;Lecture / Conte;2;5;Sur inscription
Le camp des randonneurs oubliés;Parce qu'on aime bien avoir peur !;;Bibliothèque municipale de Chalon-sur-Saône;71100;Chalon-sur-Saône;Bourgogne-Franche-Comté;Saône-et-Loire;Lecture / Conte;9;12;Entrée libre
Spectacle burlesque Banqueroute;Philippe Manceau alias Feilopô présente son spectacle « Banqueroute ». Un spectacle burlesque tout public.;clown;Médiathèque Victor Hugo;49120;Chemillé-Melay;Pays de la Loire;Maine-et-Loire;Spectacle (danse, concert, performance, théâtre…);;;Entrée libre
Escape Game autour du Roman Policier jeunesse;Escape game autour du Polar pour enfants à Tarbes (65);"Escape game;Polar;lecture à voix haute;échanges littéraires;jeux;enfants";Melting Potes;65000;Tarbes;Occitanie;Hautes-Pyrénées;Soirée jeux (jeux de société, jeux vidéo, jeux d’évasion/escape game);7;18;Entrée libre
"""Journée Magique de la lecture""";"A l'occasion de l’événement national ""La nuit de la lecture"", Le CDI de la Gardonnenque proposera plusieurs activités sur le thème des aventure de Harry Potter  et de la littérature fantastique";"Objets magiques;Magie;Sorcellerie";Collège de la Gardonnenque;30190;Brignon;Occitanie;Gard;Exposition;11;16;Entrée libre
Lectures et partage;Lectures multilingues et conversations autour d'une soupe servie par les animateurs.;"multilingue;occitan;anglais;espagnol;soupe;périgord";Bibliothèque municipale de Nabirat;24250;Nabirat;Nouvelle-Aquitaine;Dordogne;Lecture / Conte;;;Entrée libre
Soirée ciné;Projection d'un film;film;Bibliothèque municipale de Plouarzel;29810;Plouarzel;Bretagne;Finistère;Projection;12;99;Entrée libre
Jeux de société;En famille ou entre amis, venez passer un moment convivial autour de jeux de société;"jeux;société";Bibliothèque municipale de Plouarzel;29810;Plouarzel;Bretagne;Finistère;Soirée jeux (jeux de société, jeux vidéo, jeux d’évasion/escape game);;;Entrée libre
Foire aux livres, CD, revues;Grande vente de livres, CD, revues de seconde main au tarif unique de 1€ et 2€;"Exposition;Vente";Médiathèque de Fontenay-aux-Roses;92260;Fontenay-aux-Roses;Île-de-France;Hauts-de-Seine;Autre (précisez dans le champ ci-dessous);;99;Entrée libre
"Bib/Café ""Afrique""";Echange de coups de coeur, découverte de livres d'auteurs africains et de livres sur l'Afrique;Coups de coeur - Café - Afrique;Bibliothèque municipale de Brézins;38590;Brézins;Auvergne-Rhône-Alpes;Isère;Partage de coups de cœur, conseils de lecture, « speed-booking »;16;99;Entrée libre
"Présentation du livre ""Journal de Brousse"" par son auteur";"Présentation du livre ""Journal de brousse"", échange avec son auteur";Rencontre - Auteur - Afrique;Bibliothèque municipale de Brézins;38590;Brézins;Auvergne-Rhône-Alpes;Isère;Rencontre d'auteur(s) et dédicace;16;99;Entrée libre
Partage de blagues;Des blagues à disposition !;;Médiathèque B612;69230;Saint-Genis-Laval;Auvergne-Rhône-Alpes;Métropole de Lyon;Atelier;7;99;Entrée libre
Jeux de société;Jeux de société à énigmes;;Centre des Archives et de la Bibliothèque départementales de l'Aisne;2000;Laon;Hauts-de-France;Aisne;Soirée jeux (jeux de société, jeux vidéo, jeux d’évasion/escape game);;;Entrée libre
Tous à la table de jeux !;En partenariat avec la Ludo-biblio Accoord Bout des Pavés. Prêts ? Partez ! Viens te surpasser et montrer tes talents de cuistot à Overcooked, un jeu vidéo d’action culinaire complètement chaotique !;Jeux;Maison de quartier La Mano;44300;Nantes;Pays de la Loire;Loire-Atlantique;Soirée jeux (jeux de société, jeux vidéo, jeux d’évasion/escape game);;;Entrée libre
« Impro' Viste ».;Intervention drôle et décalée dite « Impro' Viste » par la Ligue d'Improvisation de Touraine;Improvisation - humour - spectacle - performance - Touraine;Médiathèque de Joué-lès-Tours;37300;Joué-lès-Tours;Centre-Val de Loire;Indre-et-Loire;Spectacle (danse, concert, performance, théâtre…);7;99;Entrée libre
Jeux de société;Aprem' jeux de société en famille, entre amis;;Mairie d'Avanne-Aveney;25720;Avanne-Aveney;Bourgogne-Franche-Comté;Doubs;Soirée jeux (jeux de société, jeux vidéo, jeux d’évasion/escape game);;;Entrée libre
Atelier suédage;Venez vous amuser à faire le remake d'une séquence culte d'un grand classique du cinéma en rejouant les scènes plus ou moins fidèlement, dans des conditions artisanales.;Atelier suédage;Médiathèque Jacques Demy;44000;Nantes;Pays de la Loire;Loire-Atlantique;Atelier;;;Entrée libre
Blind quiz test cinéma;Venez tester vos connaissances cinématographiques (bandes originales, répliques… ) dans une ambiance à la Wes Anderson.;Jeu quiz;Médiathèque Jacques Demy;44000;Nantes;Pays de la Loire;Loire-Atlantique;Soirée jeux (jeux de société, jeux vidéo, jeux d’évasion/escape game);;;Entrée libre
Laissez-vous conter le cinéma;Contes adaptés des grands classiques du cinéma pour enfants;Lectures contes;Médiathèque Jacques Demy;44000;Nantes;Pays de la Loire;Loire-Atlantique;Lecture / Conte;5;99;Entrée libre
"Lecture d'extraits du livre ""A la ligne, feuillets d'usine"" de Joseph Ponthus";Lecture d'extraits du roman de Joseph Ponthus.;"Lecture;Ponthus";Bibliothèque municipale Galilée;76350;Oissel;Normandie;Seine-Maritime;Lecture / Conte;;;Entrée libre
Lectures à haute voix aux CDI du collège et du lycée : kamishibai;Découverte d'un Kamishibai plurilingue;"lecture à haute voix;établissement scolaire;UPE2A";Collège et lycée Victor Duruy;75007;Paris;Île-de-France;;Atelier;10;99;Entrée libre
Lecture à la lampe torche;Lecture d'histoires à la lampe torche sur le thème des monstres pour les 3 - 5 ans;"lecture;histoire;monstres;camus;bourg;ain;médiathèque;animation;nuit;torche";Médiathèque Albert Camus;1000;Bourg-en-Bresse;Auvergne-Rhône-Alpes;;Lecture / Conte;3;5;Entrée libre
Projection de courts métrages;Projection de courts métrages sur le thème des monstres pour les 7 - 12 ans;"histoire;monstres;camus;bourg;ain;médiathèque;animation;nuit;projection;film;court métrage";Médiathèque Albert Camus;1000;Bourg-en-Bresse;Auvergne-Rhône-Alpes;;Projection;7;12;Entrée libre
Réalité Virtuelle;Plongez dans la réalité virtuelle avec le PSVR et l'Oculus Rift mais attention aux monstres...;"monstres;camus;bourg;ain;médiathèque;animation;nuit;réalité virtuelle;PSVR;Oculus;Jeux vidéo";Médiathèque Albert Camus;1000;Bourg-en-Bresse;Auvergne-Rhône-Alpes;;Soirée jeux (jeux de société, jeux vidéo, jeux d’évasion/escape game);14;99;Entrée libre
"Projection du film ""A la recherche des femmes chefs"" suivie d'une rencontre avec Jacotte Brazier";"venez assister à la projection du film documentaire ""À la recherche des femmes chefs"" de Vérane Frédiani. La projection sera suivie d'une rencontre avec Jacotte Brazier, petite fille d'Eugénie Brazier";"projection;rencontre;gastronomie;alimentation";Médiathèque du Bachut;69008;Lyon-8E-Arrondissement;Auvergne-Rhône-Alpes;Métropole de Lyon;Projection;;;Entrée libre
Lecture en pyjama;Lecture à voix haute;;Bibliothèque Denis Diderot;59494;Petite-Forêt;Hauts-de-France;Nord;Lecture / Conte;2;10;Sur inscription
"Conte ""La Fileuse des songes""";Qui sont ces êtres merveilleux qui habitent nos songes ?;songes - extraordinaire - bergère - cieux;Médiathèque intercommunale Olympe de Gouges;30170;Saint-Hippolyte-du-Fort;Occitanie;Gard;Lecture / Conte;2;99;Entrée libre
Once upon a time;Après-midi jeux de société;;Médiathèque municipale de Maubeuge;59600;Maubeuge;Hauts-de-France;Nord;Soirée jeux (jeux de société, jeux vidéo, jeux d’évasion/escape game);;;Sur inscription
Escape game panique dans la bibliothèque;Pour la 4e édition de la Nuit de la lecture la bibliothèque a besoin de vous ! Venez nous aider à résoudre une enquête et tenter l’expérience de l’escape game;;Médiathèque Rêve et savoir;63510;Aulnat;Auvergne-Rhône-Alpes;;Autre (précisez dans le champ ci-dessous);11;99;Sur inscription
Visites insolites de la Médiathèque;Redécouvrez les espaces publics et enfoncez-vous dans les mystères du pôle Patrimoine guidé par un bibliothécaire !;;Médiathèque Simone-Veil;59300;Valenciennes;Hauts-de-France;Nord;Visite guidée / visite insolite;;;Sur inscription
Atelier Snoezelen pour les 0-4 ans;Une stimulation multi sensorielle, une pratique visant à éveiller la sensorialité de la personne stimulée, dans une ambiance sécurisante.;;Médiathèque Simone-Veil;59300;Valenciennes;Hauts-de-France;Nord;Atelier;;4;Sur inscription
Atelier marque-page;Atelier création de marque-page !;"famille;création;marque page";Bibliothèque municipale Marie-Paule Salonne;22130;Plancoët;Bretagne;;Atelier;;;Entrée libre
Conte écologique : La banquise;Spectacle conte écologique;;Médiathèque municipale La Croisée des Arts;83470;Saint-Maximin-la-Sainte-Baume;Provence-Alpes-Côte d'Azur;Var;Spectacle (danse, concert, performance, théâtre…);2;99;Sur inscription
Venez Bruncher autour d'un Scrabble;Venez Bruncher autour d'un Scrabble;"scrabble;partage;brunch";Bibliothèque La Plume Enchantée;27440;Lisors;Normandie;Eure;Soirée jeux (jeux de société, jeux vidéo, jeux d’évasion/escape game);;;Entrée libre
Atelier Réalité virtuelle;Atelier de réalité virtuelle;"réalité virtuelle;oeuvres d'art";Bibliothèque de Colmar Pôle Média Culture Edmond Gerrer;68000;Colmar;Grand Est;Haut-Rhin;Atelier;12;99;Entrée libre
Lecgustation;Lecture-dégustation de poésie, conte, roman et vins végans.;"Plélan le grand;poésie;dégustation";Médiathèque Julien Gracq;35380;Plélan-le-Grand;Bretagne;;Lecture / Conte;7;99;Sur inscription
Soirée Moyen-Age;Animations en déambulation sur le thème du Moyen-Age;"lectures;danse;chant;Moyen-Age;jeux;activité manuelle";Médiathèque municipale d'Arques;62510;Arques;Hauts-de-France;;Atelier;4;99;Sur inscription
Des lettres et des jeux;Jeux de mots, jeux de lettres, quiz littéraire et lecture de textes par leurs auteurs.;jeu;Château de Moncourt-Fromonville;77140;Montcourt-Fromonville;Île-de-France;;Soirée jeux (jeux de société, jeux vidéo, jeux d’évasion/escape game);16;99;Entrée libre
Lectures mystérieuses en nocturne;Lecture de textes d'auteurs du village ou ayant vécu dans le village et les environs.;"fantastique;mystère";Château de Moncourt-Fromonville;77140;Montcourt-Fromonville;Île-de-France;;Lecture / Conte;16;99;Sur inscription
Ouverture exeptionnelle en soirée;La médiathèque restera exceptionnellement ouverte 2 heures de plus;;Médiathèque Marcelle Maurette;44290;Guémené-Penfao;Pays de la Loire;Loire-Atlantique;Lecture / Conte;;;Entrée libre
Lectures pour petits supers héros et super héroïnes;Avis à tous les Trop Supers Héros et Trop Supers Héroïnes. Venez découvrir les histoires et autres surprises de vos Trop Supers Bibliothécaires.;"Lectures;Suer héros";Médiathèque Lisa Bresner;44100;Nantes;Pays de la Loire;Loire-Atlantique;Lecture / Conte;2;99;Entrée libre
Tullio Corda et Le Village de tous rois : lecture spectacle;4e Nuit de la lecture à la médiathèque de Décines : samedi 18 janvier 2020, 16h-17h. Un univers minimaliste aux dimensions grandioses !;"Tullio Corda;Médiathèque de Décines";Médiathèque de Décines-Charpieu;69150;Décines-Charpieu;Auvergne-Rhône-Alpes;Métropole de Lyon;Lecture / Conte;5;99;Sur inscription
Projection d'albums Story play;Projection d’albums numériques pour les 3-8 ans à partir de l’application Story play (biblio Gironde). Pour le plaisir de partager des histoires.;;Médiathèque Andernos-les-Bains;33510;Andernos-les-Bains;Nouvelle-Aquitaine;Gironde;Projection;3;8;Sur inscription
Lecture- musique- chant;Lecture- Musique- Chant;"musique lecture;chant;texte";Bibliothèque municipale d'Albigny-sur-Saône;69250;Albigny-sur-Saône;Auvergne-Rhône-Alpes;Métropole de Lyon;Lecture / Conte;15;99;Entrée libre
Atelier bricolage;Fabrication d'objets et décorations en matériaux recyclés;bricolage recyclage;Médiathèque de la Vallée de Villé;67220;Villé;Grand Est;Bas-Rhin;Atelier;4;99;Entrée libre
Table de présentation sur Boris Vian (Livres, musique, peinture...);Présentation d'oeuvres de Boris Vian et autour de lui;"Boris Vian;Peinture;roman;chansons;albums";Bibliothèque municipale;35220;Saint-Didier;Bretagne;;Exposition;7;99;Entrée libre
Ateliers anti-gaspi;Ateliers culinaires en famille, à partir de recettes anti-gaspi !;"atelier;jeu;atelier cuisine;dégustation";Médiathèque du Bachut;69008;Lyon-8E-Arrondissement;Auvergne-Rhône-Alpes;Métropole de Lyon;Atelier;5;99;Sur inscription
Fruits et légumes animés;Initiation à la technique du stop motion;"atelier;atelier numérique";Médiathèque du Bachut;69008;Lyon-8E-Arrondissement;Auvergne-Rhône-Alpes;Métropole de Lyon;Atelier;;;Entrée libre
Enquête à la Bibliothèque;Murder party;murder party;Bibliothèque municipale de Soissons;2200;Soissons;Hauts-de-France;Aisne;Soirée jeux (jeux de société, jeux vidéo, jeux d’évasion/escape game);7;99;Sur inscription
"Partage de la "" Madeleine de Proust """;"Partage d'une "" madeleine de Proust "" à la pause déjeuner";"partage;mulhouse;dégustation";FSESJ - Campus Fonderie;68100;Mulhouse;Grand Est;;Dégustation, buffet, collation…;;;Entrée libre
Grignottage littéraire;Les Toqués du Perray viendront préparer un délicieux buffet autour duquel chacun pourra échanger  ses recettes préférées et d’une belle sélection de livres de cuisine.;"Buffet;Recettes de cuisine;Livres de cuisine";Médiathèque Floresca Guépin;44300;Nantes;Pays de la Loire;Loire-Atlantique;Dégustation, buffet, collation…;;;Entrée libre
Soirée Time's up, spécial personnages de fiction;Par équipe de 4/5 personnes, vous aurez pour mission de faire deviner le plus de personnages possibles en 30 secondes et en 3 manches. Venez-vous amuser entre amis ou en famille (à partir de 10 ans) !;"jeu;littérature";Médiathèque de Vire;14500;Vire Normandie;Normandie;Calvados;Soirée jeux (jeux de société, jeux vidéo, jeux d’évasion/escape game);;;Sur inscription
En route vers le Vietnam : projection sur les ethnies et la culture du riz;Projection;projection;Médiathèque de Bièvres;91570;Bièvres;Île-de-France;Essonne;Projection;;;Sur inscription
En route vers le Vietnam - Lectures et contes;Lectures et contes;"lecture;contes";Médiathèque de Bièvres;91570;Bièvres;Île-de-France;Essonne;Lecture / Conte;;;Sur inscription
Tirage au sort;Tirage au sort;"tirage au sort;cadeaux;chèque lire";Médiathèque Louis Aragon;92220;Bagneux;Île-de-France;;Autre (précisez dans le champ ci-dessous);;99;Entrée libre
Nuit noire : jeux vidéo;À vos manettes !;;Médiathèque intercommunale de Pont-Château;44160;Pontchâteau;Pays de la Loire;Loire-Atlantique;Soirée jeux (jeux de société, jeux vidéo, jeux d’évasion/escape game);;;Entrée libre
Nuit noire : Loterie;Gagner des chèques Lire par tirage au sort;;Médiathèque intercommunale de Pont-Château;44160;Pontchâteau;Pays de la Loire;Loire-Atlantique;Soirée jeux (jeux de société, jeux vidéo, jeux d’évasion/escape game);;;Entrée libre
Jeu de piste tout public, à partir de 7 ans;Énigmes, secrets et enquêtes vous attendent à 21h, pour les grands et les petits, à partir de 7 ans.;"jeux;énigmes";Médiathèque La Buanderie;92140;Clamart;Île-de-France;Hauts-de-Seine;Soirée jeux (jeux de société, jeux vidéo, jeux d’évasion/escape game);7;100;Sur inscription
Lectures à haute voix;La bibliothèque d'Indre et La Librairie du Quai s'associent pour vous proposer un moment de lecture à voix haute. Seul ou en duo, en famille ou entre amis, partageons un moment de lecture et d'écoute.;"lecture à voix haute;participatif;familial";Bibliothèque municipale d'Indre;44610;Indre;Pays de la Loire;Loire-Atlantique;Lecture / Conte;7;99;Entrée libre
Thriller;Cinéma;;Médiathèque intercommunale de Pont-Château;44160;Pontchâteau;Pays de la Loire;Loire-Atlantique;Projection;14;99;Entrée libre
Escape game;La momie perdue;;Médiathèque intercommunale de Pont-Château;44160;Pontchâteau;Pays de la Loire;Loire-Atlantique;Soirée jeux (jeux de société, jeux vidéo, jeux d’évasion/escape game);8;99;Entrée libre
Ados manettes !;Le coin des ados : Le jeu vidéo, c’est aussi la nuit ! Parties endiablées ou découvertes festives;"jeu vidéo;ados;consoles;coin ado";Médiathèque-Ludothèque Arcachon;33120;Arcachon;Nouvelle-Aquitaine;;Soirée jeux (jeux de société, jeux vidéo, jeux d’évasion/escape game);;;Entrée libre
Apéritif prix des lecteurs;annonce du prix des lecteurs 2019 des médiathèques intercommunales des Vosges du sud;prix des lecteurs;Médiathèque intercommunale d'Auxelles-Haut;90200;Auxelles-Haut;Bourgogne-Franche-Comté;Territoire de Belfort;Dégustation, buffet, collation…;;;Entrée libre
Enquête interactive : Qui a refroidi Lemaure ?;Venez mener l'enquête à la médiathèque.;;Médiathèque de Carentan-les-Marais;50500;Carentan Les Marais;Normandie;Manche;Soirée jeux (jeux de société, jeux vidéo, jeux d’évasion/escape game);16;99;Entrée libre
Instant musical;Dans le cadre de la quatrième Nuit de la lecture profitez de moments en chansons et en musique;"musique;chansons;nuit";Bibliothèque d'Olivet;45160;Olivet;Centre-Val de Loire;Loiret;Spectacle (danse, concert, performance, théâtre…);;99;Entrée libre
Histoire autour du pic Saint-Loup;Rencontre autour du pic Saint-Loup;"pis st loup;notre dame;conte;poésie;evenment";Bibliothèque municipale de Notre-Dame-de-Londres;34380;Notre-Dame-de-Londres;Occitanie;Hérault;Lecture / Conte;;99;Entrée libre
Lecture dans le noir;Bien installé sur des coussins ou des tapis, partez sur les traces de Toomaï des éléphants;"lecture à voix haute;lecture dans le noir;Rudyard Kipling;Toomai des Éléphants";Médiathèque de Meudon Centre;92190;Meudon;Île-de-France;Hauts-de-Seine;Lecture / Conte;6;99;Entrée libre
Une nuit avec les éléphants : ateliers en famille;dessins, histoires, quiz... et encore d'autres animations autour des éléphants;"quiz;éléphants;ateliers famille";Médiathèque de Meudon Centre;92190;Meudon;Île-de-France;Hauts-de-Seine;Atelier;4;10;Entrée libre
Escape game en famille;Découvrez d'autres facettes de la bibliothèque et venez résoudre des énigmes !;escape game;Biblio'Or Bibliothèque d'Orliénas;69530;Orliénas;Auvergne-Rhône-Alpes;Rhône;Soirée jeux (jeux de société, jeux vidéo, jeux d’évasion/escape game);;;Sur inscription
Les Livrekikour(en)t dans la nuit;"À Deyme, le 18 janvier, le Lecteur du Val propose une Nuit de la lecture ""hors-les-murs"", sur les traces du ""Livrekikourt""...";"bookcrossing;livrekikourt;lecture;jeu de piste";Bibliothèque Le Lecteur du Val;31450;Deyme;Occitanie;Haute-Garonne;Soirée jeux (jeux de société, jeux vidéo, jeux d’évasion/escape game);;;Entrée libre
Dictées décalées;Nuit des partages à la médiathèque l'Eau Vive : dictées décalées, atelier créatif héros de littérature jeunesse, contes, quizz littéraires, lectures...;"Dictée;Concours";Médiathèque l'Eau Vive;54360;Blainville-sur-l'Eau;Grand Est;;Concours;8;99;Sur inscription
"Contes : ""Histoires de neige, histoires de nuit""";Nuit des partages à la médiathèque l'Eau Vive : dictées décalées, atelier créatif héros de littérature jeunesse, contes, quizz littéraires, lectures...;Contes;Médiathèque l'Eau Vive;54360;Blainville-sur-l'Eau;Grand Est;;Lecture / Conte;3;99;Entrée libre
Formes et couleurs;Atelier créatif animé par Gaby Bazin;"Père Castor;Illustrateurs;atelier créatif";Médiathèque Jacques Demy;44000;Nantes;Pays de la Loire;Loire-Atlantique;Atelier;6;99;Sur inscription
Conte numérique;Conte interactif raconté sur tablette.;"Lectures;Tablette";Médiathèque Lisa Bresner;44100;Nantes;Pays de la Loire;Loire-Atlantique;Lecture / Conte;6;99;Entrée libre
Escape Game;En 60 minutes chrono, venez résoudre le mystère de l'abbaye.;Jeu Enigme Mystère Enquête;Bibliothèque départementale de la Somme;80135;Saint-Riquier;Hauts-de-France;Somme;Soirée jeux (jeux de société, jeux vidéo, jeux d’évasion/escape game);3;99;Sur inscription
